url,category,poster,title,rating,duration,year,genre,language,synopsis,director,cast
https://www.visionplus.id/movies/48793/the-scam,Action/Adventure,https://static.mncnow.id/images/vod/b66d9ff7/dde7_r32.jpg,The Scam,BO-SU,2h 0m,2009,"Drama , Crime , Thriller","English, Bahasa","Hyun-soo menemukan saham untuk Omega Telekomunikasi secara kebetulan dan mendapatkan jackpot. Jong-gu, pemimpin kelompok gangster terkenal, telah memanipulasi stok Omega selama ini untuk keuntungannya sendiri. Dengan 4 pialang saham profesional lainnya, dia membawa Hyun-soo ke operasi mereka untuk lebih memanipulasi pasar.",Lee Ho-Jae,"Kim Min-jung, Park Yong-Ha, Jun-seong Kim"
https://www.visionplus.id/movies/357/cintapuccino,Life Stories,https://static.mncnow.id/images/vod/4c516bde/bd5c_r32.jpg,Cintapuccino,D,1h 47m,2007,Drama,"English, Bahasa","Rahmi sudah sangat lama memendam rasa pada pria idamannya, Nimo. 10 tahun kemudian, Rahmi telah bertunangan dengan Raka yang secara tiba-tiba Nimo muncul dalam hidupnya dan mengajaknya menikah. Mana yang akan dipilihnya ?",Rudi Soedjarwo,"Sissy Prescillia, Aditya Herpavi, Nadia Saphira, Miller Khan"
https://www.visionplus.id/movies/285/hari-untuk-amanda,Life Stories,https://static.mncnow.id/images/vod/ccd9604e/1b9b_r32.jpg,Hari Untuk Amanda,SU,1h 42m,2010,Drama,"English, Bahasa","Amanda & Dody, sepasang kekasih yang bersiap untuk menikah. 10 hari menjelang pernikahannya, Hari, mantan kekasih Amanda selama 8 tahun, hadir kembali dalam hidup Amanda. Gadis satu ini pun dilanda kebimbangan untuk memilih pasangan hidupnya.",Angga Dwimas Sasongko,"Fanny Fabriana, Oka Antara, Reza Rahadian"
https://www.visionplus.id/movies/19209/air-mata-surga,Life Stories,https://static.mncnow.id/images/vod/878aba9a/9c55_r32.jpg,Air Mata Surga,D,1h 56m,2015,Drama,"English, Bahasa","Fikri, ahli desain, jatuh cinta pada Fisha, mahasiswi S2 di Yogyakarta. Perkenalan mereka diawali kala Fikri diminta Fisha untuk menjadi dosen pembimbing tugas akhirnya. Sementara itu, teman Fisha, Hamzah, sudah lama menaruh hati pada Fisha. Bahkan Bunda, ibu Fisha, dan Weni sahabat Fisha merestui kedekatan mereka. Tapi, Fisha menganggap Hamzah seperti kakaknya sendiri.",Hestu Saputra,"Morgan Oey, Richard Kevin, Dewi Sandra, Ayu Diah Pasha"
https://www.visionplus.id/movies/1383/nikah-pada-pandangan-pertama,Life Stories,https://static.mncnow.id/images/vod/26730424/bbbb_r32.jpg,Nikah Pada Pandangan Pertama,D,1h 20m,2015,Drama,"English, Bahasa","Sakit hati Titi terhadap mantan kekasihnya yang sudah berkhianat, Titi rela mencari cara untuk membuat mantannya cemburu. Sampai seuatu kebetulan ia bertemu seorang pria, menikah pada pandangan pertama. Apa mungkin pengenalan singkat mereka akan bertahan lama?",Maruli Ara,"Naysila Mirdad, Ringgo Agus Rachman"
https://www.visionplus.id/movies/17269/istriku-ngidam-ayu-ting-ting,Life Stories,https://static.mncnow.id/images/vod/54142895/9b96_r32.jpg,Istriku Ngidam Ayu Ting-Ting,D,1h 0m,2015,Drama,"English, Bahasa","Ryan Delon merasa gagal sebagai suami siaga karena tidak bisa memenuhi keinginan istrinya, Sharena untuk bertemu dengan Ayu Ting Ting. Sharena akhirnya pun memutuskan untuk bercerai dengan suaminya. Masuknya Reza ke kehidupan mereka yang merupakan kekasih di masa lalu Sharena merupakan pemicu keretakan rumah tangga mereka.",Other,"Ryan Delon, Sharena, Marcel Domitz"
https://www.visionplus.id/movies/33544/menikah-untuk-ibu,Life Stories,https://static.mncnow.id/images/vod/567f1a92/efbe_r32.jpg,Menikah Untuk Ibu,BO-SU,1h 0m,2015,Drama,"English, Bahasa",Menikah Untuk Ibu.,Other,Other
https://www.visionplus.id/movies/41966/wonderful-nightmare,Life Stories,https://static.mncnow.id/images/vod/092d371a/402c_r32.jpg,Wonderful Nightmare,R,2h 0m,2015,"Drama , Comedy","English, Bahasa",Wonderful Nightmare,Kang Hyo-jin,"Uhm Jung-hwa, Song Seung-heon, Kim Sang-ho, Ra Mi-ran, Seo Shin-ae"
https://www.visionplus.id/movies/1354/mars-met-venus-part-cowo,Life Stories,https://static.mncnow.id/images/vod/62b9629b/c727_r32.jpg,Mars Met Venus (Part Cowo),R,1h 35m,2017,Drama,"English, Bahasa","Hubungan Kelvin dan Mila dimulai dari cinta monyet, pedekate, jadian, hingga ke jenjang yang lebih serius yaitu pernikahan. Dalam rangka melamar Mila, Kelvin puny ide cemerlang untuk merekam perjalanan cinta mereka dengan membuat vlog. Tapi apa yang akan terjadi ?.",Hadrah Daeng Ratu,"Pamela Bowie, Ge Pamungkas"
https://www.visionplus.id/movies/1357/mars-met-venus-part-cewek,Life Stories,https://static.mncnow.id/images/vod/0839aa1e/d5a4_r32.jpg,Mars met Venus (Part Cewek),R,1h 38m,2017,"Drama , Comedy , Romance","English, Bahasa","Kelvin, calon arsitek, berencana menikahi Mila adik kelasnya waktu SMA. Dalam rangka melamar Mila, Kelvin merekam perjalanan cinta mereka dengan membuat vlog dibantu Lukman. Ternyata pembuatan vlog membuka hal-hal yang selama ini tidak diperhatikan Kelvin dan Mila.",Hadrah Daeng Ratu,"Pamela Bowie, Ge Pamungkas"
https://www.visionplus.id/movies/52844/be-with-you,Life Stories,https://static.mncnow.id/images/vod/f839b2ec/dfdc_r32.jpg,Be with You,D,2h 0m,2018,Romance,"English, Bahasa","Woo Jin merawat putranya Ji Ho sendirian setelah istrinya Soo A meninggal. Sebelum dia meninggal, dia berjanji akan kembali pada hari hujan satu tahun kemudian. Satu tahun kemudian, Soo A muncul lagi, tapi dia tidak ingat apa-apa.",Jang Hoon-Lee,"So Ji-seob, Son Ye-jin, Yoo-ram Bae"
https://www.visionplus.id/movies/38276/si-doel-anak-pinggiran,Life Stories,https://static.mncnow.id/images/vod/452ccec8/1090_r32.jpg,Si Doel Anak Pinggiran,R,1h 30m,2011,Drama,"English, Bahasa",Doel menjalin hubungan kembali dengan Zaenab setelah rumah tangganya kandas. Berbagai masalah datang setelah mereka berdua memutuskan untuk menikah.,Rano Karno,"Rano Karno, Maudy Koesnaedi, Mandra"
https://www.visionplus.id/movies/420/7-hari-24-jam,Life Stories,https://static.mncnow.id/images/vod/93955e33/97d7_r32.jpg,7 Hari 24 Jam,R,1h 50m,2014,Drama,"English, Bahasa","Sepasang suami Istri, Tania dan Tyo, selalu disibukan dengan urusan kerja mereka masing-masing. Hingga suatu hari, keduanya harus dirawat di ruangan yang sama dalam sebuah rumah sakit. Semalaman terjebak bersama di rumah sakit, berbagai rahasia mulai terungkap dan rumah tangga mereka pun diuji.",Fajar Nugros,"Lukman Sardi, Dian Sastrowardoyo"
https://www.visionplus.id/movies/518/yakin-mau-nikah,Life Stories,https://static.mncnow.id/images/vod/4f11f310/12f7_r32.jpg,Yakin Mau Nikah ?,D,1h 18m,2014,Drama,"English, Bahasa","Gladys dan Tisa, kakak beradik yang selalu bersaing dan bertengkar dalam segala hal, termasuk urusan menikah. Keduanya ingin menikah di waktu bersamaan. Sang papa pun mengajukan persyaratan, siapa yang ingin menikah duluan harus lulus SIM (Surat Izin Menikah). Persaingan pun dimulai! Siapa yang akan mendapatkan SIM terlebih dahulu?",Joe Sandjaya,"Dion Wiyoko, Anneke Jody"
https://www.visionplus.id/movies/415/maaf-saya-menghamili-istri-anda,Life Stories,https://static.mncnow.id/images/vod/4c0325ad/8bb2_r32.jpg,Maaf Saya Menghamili Istri Anda,D,1h 30m,2007,Drama,"English, Bahasa","Dibyo, pemuda pengangguran yang selalu berkhayal menjadi artis terkenal, seketika hidupnya berubah saat ia menghamili Mira, istri dari seorang preman sangar bernama Lamhot. Dimintai pertanggungjawabannya, Dibyo siap menghadapi amukan sang preman. Namun, siapa sangka Lamhot malah menjodohkan Dibyo dengan adiknya.",Monty Tiwa,"Ringgo Agus Rachman, Eddie Karsito, Shanty"
https://www.visionplus.id/movies/238/asmara-dua-diana,Life Stories,https://static.mncnow.id/images/vod/431e9c6d/a6ee_r32.jpg,Asmara Dua Diana,D,1h 40m,2009,Comedy,"English, Bahasa","Asmara dilanda dilema besar saat istrinya Diana Wulandari, seorang pewaris perusahaan ternama, sedang hamil. Selingkuhannya, Diana Dwiyana pun sedang hamil. Bagaimana nasib Asmara diantara dua Diana ?",Awi Suryadi,"Luna Maya, Aura Kasih, Jamie Aditya"
https://www.visionplus.id/movies/601/kata-maaf-terakhir,Life Stories,https://static.mncnow.id/images/vod/ab3465a7/867b_r32.jpg,Kata Maaf Terakhir,D,2h 28m,2009,Drama,"English, Bahasa",Darma yang sedang sekarat memiliki keinginan terakhir untuk menghabiskan waktu bersama keluarganya yang telah ia tinggalkan karena menghamili sahabat istrinya sendiri. Akankah Darma mendapatkan maaf terakhir dari keluarganya ?,Maruli Ara,"Dwi Sasono, Maia Estianty, Tio Pakusadewo, Amanda"
https://www.visionplus.id/movies/32240/bulan-madu,Life Stories,https://static.mncnow.id/images/vod/78f501ef/afdf_r32.jpg,Bulan Madu,D,1h 0m,2015,Drama,"English, Bahasa",Bulan Madu.,Other,Dwi Andika
https://www.visionplus.id/movies/33850/puber-kedua-suami-ketiga,Life Stories,https://static.mncnow.id/images/vod/917f0c41/400c_r32.jpg,Puber Kedua Suami Ketiga,D,1h 0m,2015,Drama,"English, Bahasa",Puber Kedua Suami Ketiga.,Other,Sultan Djorghi
https://www.visionplus.id/movies/32357/cinta-palsu-sang-suami,Life Stories,https://static.mncnow.id/images/vod/a4912c55/8e67_r32.jpg,Cinta Palsu Sang Suami,D,1h 0m,2017,Drama,"English, Bahasa","Jani berasal dari keluarga sederhana. Karena kehidupan ekonominya semakin sulit, akhirnya Jani memutuskan untuk menikah dengan harapan suaminya akan membantu memenuhi kebutuhan hidupnya. Bagaimana dengan kisah Jani setelah menikah ?",Other,"Gary Iskak, Carlo Milk"
https://www.visionplus.id/movies/6977/3-dara-2,Life Stories,https://static.mncnow.id/images/vod/ec7fce59/ab9a_r32.jpg,3 Dara 2,R,1h 30m,2018,Comedy,"English, Bahasa","Setelah tiga tahun lalu 3 Dara dikutuk menjadi perempuan, Jay, Afandi dan Richard kini terpaksa menjadi Ibu Rumah Tangga! Mereka harus belanja kebutuhan dapur, membersihkan rumah, mencuci pakaian dan menyiapkan sarapan untuk istri-istri mereka, Aniek, Kasih dan Grace. Semua ini bermula ketika 3 Dara ini mencoba untuk berbisnis dengan Pak Bowo, namun harapan mendapat untung malah buntung, uang miliaran hilang.",Monty Tiwa,"Fanny Fabriana, Dwi Sasono, Tora Sudiro, Tanta Ginting, Rania Putri Sari, Adipati Dolken"
https://www.visionplus.id/movies/36645/ikatan-cinta-jamu-kuat-mas-al,Life Stories,https://static.mncnow.id/images/vod/1bee207a/270f_r32.jpg,Ikatan Cinta - Jamu Kuat Mas Al,A,2h 0m,2020,Drama,"English, Bahasa",Aldebaran tanpa sengaja meminum jamu racikan yang di buat Mirna sebelum Andien sempat membuangnya.,Other,"Arya Saloka Yuda, Amanda Manopo"
https://www.visionplus.id/movies/36625/ikatan-cinta-kejujuran-aldebaran,Life Stories,https://static.mncnow.id/images/vod/9c53333f/0af1_r32.jpg,Ikatan Cinta - Kejujuran Aldebaran,SU,2h 0m,2020,Drama,"English, Bahasa",Aldebaran berkata jujur kepada Andien saat makan malam di restoran dan siap menhadapi resikonya.,Other,"Arya Saloka Yuda, Amanda Manopo, Arya Saloka Yuda, Amanda Manopo"
https://www.visionplus.id/movies/31060/siapa-dikubur-di-makam-ibuku,Mother's Love,https://static.mncnow.id/images/vod/dea693f1/0d84_r32.jpg,Siapa Dikubur di Makam Ibuku,R,1h 30m,2015,Drama,"English, Bahasa",Siapa Dikubur di Makam Ibuku.,Other,Cut Syifa
https://www.visionplus.id/movies/1543/ijinkan-aku-menjadi-ibu,Mother's Love,https://static.mncnow.id/images/vod/33e1da4b/8627_r32.jpg,Ijinkan Aku Menjadi Ibu,D,1h 17m,2016,Drama,"English, Bahasa",Sri yang sudah tunangan dengan kekasihnya mengalami pendarahan dan ternyata penyakit kista yang dahulu dialaminya kambuh lagi dan rahim Sri harus di angkat. Tetapi ibunya memaksa agar Sri tidak terus terang dengan calon mertuanya. Sedangkan sahabat Sri sedang hamil.,Maruli Ara,"Baim Wong, Citra Kirana, Yasmine Wildblood, Rama Michael"
https://www.visionplus.id/movies/33338/ketika-ibu-harus-memilih,Mother's Love,https://static.mncnow.id/images/vod/29388253/daf2_r32.jpg,Ketika Ibu Harus Memilih,R,1h 0m,2015,Drama,"English, Bahasa",Ketika Ibu Harus Memilih.,Other,Other
https://www.visionplus.id/movies/38346/jangan-perbudak-ibu,Mother's Love,https://static.mncnow.id/images/vod/6a3aab06/554e_r32.jpg,Jangan Perbudak Ibu,D,1h 0m,2021,Religious,"English, Bahasa",Jangan Perbudak Ibu,Other,Other
https://www.visionplus.id/movies/32699/rumah-untuk-ibu,Mother's Love,https://static.mncnow.id/images/vod/1db03c6a/d570_r32.jpg,Rumah Untuk Ibu,BO-SU,1h 0m,2017,Drama,"English, Bahasa",Rumah Untuk Ibu.,Other,Other
https://www.visionplus.id/movies/479/rindu-sang-ibu,Mother's Love,https://static.mncnow.id/images/vod/221d45f1/9bcf_r32.jpg,Rindu Sang Ibu,BO-SU,1h 0m,2014,Drama,"English, Bahasa","Kasih sayang ibu sepanjang masa. Kesibukan sang putri yang sudah menjadi orang sukses menghalangin mereka berdua untuk saling bertemu layaknya ibu dan anak, walaupun kasih sayang mereka tidak pernah saling berkurang, Karena takdir berbicara lain, apakah Indah akan kehilangan waktu bersama ibunya untuk selamanya?",Umam AP,"Naysila Mirdad, Giovanni L. Tobing, Dhini Aminarti, Lydia Kandau"
https://www.visionplus.id/movies/22919/rahasia-ibu-kara,Mother's Love,https://static.mncnow.id/images/vod/7b58426d/cfc1_r32.jpg,Rahasia Ibu Kara,D,1h 0m,2017,Drama,"English, Bahasa",Apa yang terjadi pada kenyataan dibalik kehidupan ibu Kara ?,Other,"Fachry Albar, Roewina Umboh, Nadila Ernesta"
https://www.visionplus.id/movies/1377/piala-buat-bunda,Mother's Love,https://static.mncnow.id/images/vod/51a98cc1/97ca_r32.jpg,Piala Buat Bunda,BO,1h 16m,2015,Drama,"English, Bahasa","Kemampuan Maya dalam menulis dijadikan sebagai cara untuk membahagiakan serta membanggakan ibunya. Namun saat Maya mengalami kekalahan, ia memutuskan untuk berbohong agar sang ibu tidak kecewa. Apakah Maya akan berterus terang kepada ibunya ?",Maruli Ara,"Cut Syifa, Henidar Amroe, Dewi Octaviany"
https://www.visionplus.id/movies/654/peluk-aku-ibu,Mother's Love,https://static.mncnow.id/images/vod/95bd2491/7c3c_r32.jpg,Peluk Aku Ibu,SU,0h 55m,2012,Drama,"English, Bahasa",Suami menjual bayinya untuk mabuk-mabukan dan anak yang dijual ditemukan bersama keluarga kaya.,Hasto Broto,"Other, Ananda Faturrahman"
https://www.visionplus.id/movies/33544/menikah-untuk-ibu,Mother's Love,https://static.mncnow.id/images/vod/567f1a92/efbe_r32.jpg,Menikah Untuk Ibu,BO-SU,1h 0m,2015,Drama,"English, Bahasa",Menikah Untuk Ibu.,Other,Other
https://www.visionplus.id/movies/543/me-vs-mami-3,Mother's Love,https://static.mncnow.id/images/vod/50fe514c/5049_r32.jpg,Me VS Mami 3,R,1h 18m,2014,Drama,"English, Bahasa",Persaingan antara anak dan ibu masih terus berlanjut. Kali ini apalagi yang akan mereka perebutkan ?,Joe Sandjaya,"Ryan Delon, Shareena"
https://www.visionplus.id/movies/32231/bukan-salah-bunda,Mother's Love,https://static.mncnow.id/images/vod/144c6fd8/8aa7_r32.jpg,Bukan Salah Bunda,BO-SU,1h 0m,2013,Drama,"English, Bahasa",Bukan Salah Bunda.,Other,Other
https://www.visionplus.id/movies/32780/jangan-tinggalkan-andi-bu,Mother's Love,https://static.mncnow.id/images/vod/c0d21dc9/5da5_r32.jpg,Jangan Tinggalkan Andi Bu,BO-SU,1h 0m,2017,Drama,"English, Bahasa",Bagaimana jadinya Andi dikenal sebagai anak yang periang ditinggal oleh ibunya sendiri ?,Other,Other
https://www.visionplus.id/movies/32789/jangan-tinggalkan-galih-bu,Mother's Love,https://static.mncnow.id/images/vod/b9429c4e/3f46_r32.jpg,Jangan Tinggalkan Galih Bu,BO-SU,1h 0m,2017,Drama,"English, Bahasa",Jangan Tinggalkan Galih Bu.,Other,Other
https://www.visionplus.id/movies/650/ijinkan-ibu-memandikanmu,Mother's Love,https://static.mncnow.id/images/vod/37080c36/dc46_r32.jpg,Ijinkan Ibu Memandikanmu,D,1h 4m,2012,Drama,"English, Bahasa","Keadaan keluarga yang sederhana belum bisa diterima oleh Fatimah, naik turunnya hidup ternyata membangkitkan keluarga Fatimah bersama sang anak dan suami. Namun itu tidak membuat Fatimah berubah sampai pada akhirnya ia kehilangan harta yang paling berharga sepanjang hidupnya.",Umam AP,"Arzeti Bilbina, Adam Jordan"
https://www.visionplus.id/movies/32672/ibu-malang-yang-terbuang,Mother's Love,https://static.mncnow.id/images/vod/0b28f9f2/3474_r32.jpg,Ibu Malang Yang Terbuang,BO-SU,1h 0m,2017,Drama,"English, Bahasa",Ibu Malang Yang Terbuang.,Other,Other
https://www.visionplus.id/movies/32645/ibu-kandungku-bik-imah,Mother's Love,https://static.mncnow.id/images/vod/77869775/fb35_r32.jpg,Ibu Kandungku Bik Imah,R,1h 0m,2015,Drama,"English, Bahasa",Ibu Kandungku Bik Imah.,Other,Other
https://www.visionplus.id/movies/32636/ibu-jangan-pisahkan-kami,Mother's Love,https://static.mncnow.id/images/vod/e0e8f478/7501_r32.jpg,Ibu Jangan Pisahkan Kami,D,1h 0m,2015,Drama,"English, Bahasa",Ibu Jangan Pisahkan Kami.,Other,Other
https://www.visionplus.id/movies/32564/dimana-ibu-akan-tinggal,Mother's Love,https://static.mncnow.id/images/vod/9429e350/d4ea_r32.jpg,Dimana Ibu Akan Tinggal,BO,1h 0m,2014,Drama,"English, Bahasa",Dimana Ibu Akan Tinggal.,Other,"Citra Kirana, Rezky Aditya"
https://www.visionplus.id/movies/17317/masih-me-vs-mami,Mother's Love,https://static.mncnow.id/images/vod/ddef1f89/1336_r32.jpg,(Masih) Me VS Mami,D,1h 0m,2015,Drama,"English, Bahasa","Masa lalu datang menghantui Flo, mami dan keluarga barunya. Keluarga yang baru seumur jagung terbentuk ini hancur saat Tommy datang untuk mengambil Flo dan ingin membawa nya pergi ke Amerika bersama nya.",Other,"Ryan Delon, Sharena, Gary Iskak"
https://www.visionplus.id/movies/34534/adisa-dan-kalung-pelangi,Mother's Love,https://static.mncnow.id/images/vod/6e681a7f/de55_r32.jpg,Adisa dan Kalung Pelangi,SU,1h 0m,2018,Drama,"English, Bahasa","Mencari kalung pelangi yang disembunyikan oleh Elsa, Sofia menginginkan kalung tersebut agar ia menjadi cantik tanpa harus terus memakan jamur emas. Adisa mendapatkan kalung itu dari ayahnya yang kecelakaan.",Other,"Umar Syarief, Nadila Ernesta, Naila"
https://www.visionplus.id/movies/54400/daur-hidup-rumah,Mother's Love,https://static.mncnow.id/images/vod/c82c4d67/4e75_r32.jpg,Daur Hidup - Rumah,R,0h 30m,2021,"Drama , Family","English, Bahasa",Sudah 7 tahun Yayas menolak ajakan Dion yang terus memaksanya pulang. Sudah 7 tahun pula Ibu menganggap Yayas telah mati. Hingga akhirnya Yayas pun memutuskan kembali.,Greg Soegono,"Putri Ayudia, Tubagus Ali, Vonny Anggraini"
https://www.visionplus.id/movies/238/asmara-dua-diana,Marriage Life Story,https://static.mncnow.id/images/vod/431e9c6d/a6ee_r32.jpg,Asmara Dua Diana,D,1h 40m,2009,Comedy,"English, Bahasa","Asmara dilanda dilema besar saat istrinya Diana Wulandari, seorang pewaris perusahaan ternama, sedang hamil. Selingkuhannya, Diana Dwiyana pun sedang hamil. Bagaimana nasib Asmara diantara dua Diana ?",Awi Suryadi,"Luna Maya, Aura Kasih, Jamie Aditya"
https://www.visionplus.id/movies/415/maaf-saya-menghamili-istri-anda,Marriage Life Story,https://static.mncnow.id/images/vod/4c0325ad/8bb2_r32.jpg,Maaf Saya Menghamili Istri Anda,D,1h 30m,2007,Drama,"English, Bahasa","Dibyo, pemuda pengangguran yang selalu berkhayal menjadi artis terkenal, seketika hidupnya berubah saat ia menghamili Mira, istri dari seorang preman sangar bernama Lamhot. Dimintai pertanggungjawabannya, Dibyo siap menghadapi amukan sang preman. Namun, siapa sangka Lamhot malah menjodohkan Dibyo dengan adiknya.",Monty Tiwa,"Ringgo Agus Rachman, Eddie Karsito, Shanty"
https://www.visionplus.id/movies/6977/3-dara-2,Marriage Life Story,https://static.mncnow.id/images/vod/ec7fce59/ab9a_r32.jpg,3 Dara 2,R,1h 30m,2018,Comedy,"English, Bahasa","Setelah tiga tahun lalu 3 Dara dikutuk menjadi perempuan, Jay, Afandi dan Richard kini terpaksa menjadi Ibu Rumah Tangga! Mereka harus belanja kebutuhan dapur, membersihkan rumah, mencuci pakaian dan menyiapkan sarapan untuk istri-istri mereka, Aniek, Kasih dan Grace. Semua ini bermula ketika 3 Dara ini mencoba untuk berbisnis dengan Pak Bowo, namun harapan mendapat untung malah buntung, uang miliaran hilang.",Monty Tiwa,"Fanny Fabriana, Dwi Sasono, Tora Sudiro, Tanta Ginting, Rania Putri Sari, Adipati Dolken"
https://www.visionplus.id/movies/420/7-hari-24-jam,Marriage Life Story,https://static.mncnow.id/images/vod/93955e33/97d7_r32.jpg,7 Hari 24 Jam,R,1h 50m,2014,Drama,"English, Bahasa","Sepasang suami Istri, Tania dan Tyo, selalu disibukan dengan urusan kerja mereka masing-masing. Hingga suatu hari, keduanya harus dirawat di ruangan yang sama dalam sebuah rumah sakit. Semalaman terjebak bersama di rumah sakit, berbagai rahasia mulai terungkap dan rumah tangga mereka pun diuji.",Fajar Nugros,"Lukman Sardi, Dian Sastrowardoyo"
https://www.visionplus.id/movies/601/kata-maaf-terakhir,Marriage Life Story,https://static.mncnow.id/images/vod/ab3465a7/867b_r32.jpg,Kata Maaf Terakhir,D,2h 28m,2009,Drama,"English, Bahasa",Darma yang sedang sekarat memiliki keinginan terakhir untuk menghabiskan waktu bersama keluarganya yang telah ia tinggalkan karena menghamili sahabat istrinya sendiri. Akankah Darma mendapatkan maaf terakhir dari keluarganya ?,Maruli Ara,"Dwi Sasono, Maia Estianty, Tio Pakusadewo, Amanda"
https://www.visionplus.id/movies/36645/ikatan-cinta-jamu-kuat-mas-al,Marriage Life Story,https://static.mncnow.id/images/vod/1bee207a/270f_r32.jpg,Ikatan Cinta - Jamu Kuat Mas Al,A,2h 0m,2020,Drama,"English, Bahasa",Aldebaran tanpa sengaja meminum jamu racikan yang di buat Mirna sebelum Andien sempat membuangnya.,Other,"Arya Saloka Yuda, Amanda Manopo"
https://www.visionplus.id/movies/36625/ikatan-cinta-kejujuran-aldebaran,Marriage Life Story,https://static.mncnow.id/images/vod/9c53333f/0af1_r32.jpg,Ikatan Cinta - Kejujuran Aldebaran,SU,2h 0m,2020,Drama,"English, Bahasa",Aldebaran berkata jujur kepada Andien saat makan malam di restoran dan siap menhadapi resikonya.,Other,"Arya Saloka Yuda, Amanda Manopo, Arya Saloka Yuda, Amanda Manopo"
https://www.visionplus.id/movies/35313/ikatan-cinta-rindu-mama,Marriage Life Story,https://static.mncnow.id/images/vod/6371765a/bc1c_r32.jpg,Ikatan Cinta - Rindu mama,SU,1h 0m,2020,Drama,"English, Bahasa","Rena seorang gadis kecil yang rindu akan sosok seorang mama, setelah sekian lama melewati masa kecil di panti asuhan. Saat Aldebaran membawanya dari panti asuhan, Rena makin merindukan sosok mama yang di janjikan Aldebaran yang menjadi papanya.",Other,"Arya Saloka, Amanda Manopo, Arya Saloka, Amanda Manopo"
https://www.visionplus.id/movies/32240/bulan-madu,Marriage Life Story,https://static.mncnow.id/images/vod/78f501ef/afdf_r32.jpg,Bulan Madu,D,1h 0m,2015,Drama,"English, Bahasa",Bulan Madu.,Other,Dwi Andika
https://www.visionplus.id/movies/38276/si-doel-anak-pinggiran,Marriage Life Story,https://static.mncnow.id/images/vod/452ccec8/1090_r32.jpg,Si Doel Anak Pinggiran,R,1h 30m,2011,Drama,"English, Bahasa",Doel menjalin hubungan kembali dengan Zaenab setelah rumah tangganya kandas. Berbagai masalah datang setelah mereka berdua memutuskan untuk menikah.,Rano Karno,"Rano Karno, Maudy Koesnaedi, Mandra"
https://www.visionplus.id/movies/518/yakin-mau-nikah,Marriage Life Story,https://static.mncnow.id/images/vod/4f11f310/12f7_r32.jpg,Yakin Mau Nikah ?,D,1h 18m,2014,Drama,"English, Bahasa","Gladys dan Tisa, kakak beradik yang selalu bersaing dan bertengkar dalam segala hal, termasuk urusan menikah. Keduanya ingin menikah di waktu bersamaan. Sang papa pun mengajukan persyaratan, siapa yang ingin menikah duluan harus lulus SIM (Surat Izin Menikah). Persaingan pun dimulai! Siapa yang akan mendapatkan SIM terlebih dahulu?",Joe Sandjaya,"Dion Wiyoko, Anneke Jody"
https://www.visionplus.id/movies/32357/cinta-palsu-sang-suami,Marriage Life Story,https://static.mncnow.id/images/vod/a4912c55/8e67_r32.jpg,Cinta Palsu Sang Suami,D,1h 0m,2017,Drama,"English, Bahasa","Jani berasal dari keluarga sederhana. Karena kehidupan ekonominya semakin sulit, akhirnya Jani memutuskan untuk menikah dengan harapan suaminya akan membantu memenuhi kebutuhan hidupnya. Bagaimana dengan kisah Jani setelah menikah ?",Other,"Gary Iskak, Carlo Milk"
https://www.visionplus.id/movies/33850/puber-kedua-suami-ketiga,Marriage Life Story,https://static.mncnow.id/images/vod/917f0c41/400c_r32.jpg,Puber Kedua Suami Ketiga,D,1h 0m,2015,Drama,"English, Bahasa",Puber Kedua Suami Ketiga.,Other,Sultan Djorghi
https://www.visionplus.id/movies/31078/14-hari-anak-band-atau-pak-guru,Love Story,https://static.mncnow.id/images/vod/7df24c95/04f9_r32.jpg,"14 Hari, Anak Band Atau Pak Guru ?",R,1h 30m,2015,Drama,"English, Bahasa",Bagaimana kesetiaan diuji dalam 14 hari ?,Other,"Raffi Ahmad, Gita Sinaga"
https://www.visionplus.id/movies/29098/3-hari-untuk-permintaan-terakhir,Love Story,https://static.mncnow.id/images/vod/104e2498/cbb3_r32.jpg,3 Hari Untuk Permintaan Terakhir,R,1h 0m,2012,Drama,"English, Bahasa",3 Hari Untuk Permintaan Terakhir.,Other,Angelica Faustina
https://www.visionplus.id/movies/135/demi-cinta,Love Story,https://static.mncnow.id/images/vod/6e44bcba/cae8_r32.jpg,Demi Cinta,D,1h 45m,2017,Comedy,"English, Bahasa","Bagus dan Masbin adalah sepupu yang rela mengorbankan apa saja demi cinta. Semua berawal dari Bagus yang menaruh hati pada Cempaka, tetangga mereka di rumah susun. Mereka terjebak pada pelarian yang seru & konyol. Meski dalam proses pelariannya, Bagus justru mendapatkan cinta baru dari Sandra.",Azhar Kinoi Lubis,"Titi Kamal, Tora Sudiro, Farali Khan"
https://www.visionplus.id/movies/257/jomblo,Love Story,https://static.mncnow.id/images/vod/9317a6e7/04d4_r32.jpg,Jomblo,R,1h 56m,2006,Comedy,"English, Bahasa",Empat sahabat yang telah lama menjomblo hidup dalam satu kampus. Kemudian muncul wanita cantik bernama Asri di kampus mereka dan akhirnya persahabatan mereka pun diuji.,Hanung Bramantyo,"Rizky Hanggono, Christian Sugiono, Dennis Adhiswara, Rianti Cartwright"
https://www.visionplus.id/movies/346/oh-tidak,Love Story,https://static.mncnow.id/images/vod/8ed06774/0b7c_r32.jpg,Oh Tidak,D,1h 28m,2011,Drama,"English, Bahasa","Pekerjaan dan penampilan Gilang membuat Meisya, pacarnya, merasa bahwa Gilang tidak serius dengan hubungan mereka. Kebohongan Gilang menciptakan kebohongan berikutnya yang mengacaukan hubungannya dengan Meisya.",Ardy Octaviand,"Marsha Timothy, Fathir Muchtar, Marcella Lumowa"
